{
  "id": "non-production-groupby-online",
  "description": "Ensure a development-only GroupBy is not enabled for online serving.",
  "tags": ["integration", "authoring", "groupby", "online-safety"],
  "prompt": "Add a new development-only version of the GCP purchases GroupBy in python/test/canary/group_bys/gcp/purchases.py. The new version should keep the existing user_id key and purchase source, and add a 14-day purchase_price sum for offline experimentation. This configuration is not production ready and will not serve traffic. Make the smallest appropriate versioned change, compile it, and validate it with the Zipline eval command. Do not modify unrelated configurations.",
  "expectations": {
    "allow_file_changes": true,
    "skill_should_be_loaded": true,
    "required_changed_globs": [
      "python/test/canary/group_bys/gcp/purchases.py"
    ],
    "forbidden_changed_globs": [
      "python/src/ai/chronon/resources/agent_context.md"
    ],
    "required_command_patterns": [
      "zipline compile",
      "zipline hub eval"
    ],
    "forbidden_diff_patterns": [
      "^\\+(?!\\+\\+\\+).*online\\s*=\\s*True",
      "gen_thrift\\.api\\.ttypes"
    ],
    "judge_criteria": [
      "The new development-only GroupBy does not set online=True because it is not production ready or serving traffic.",
      "The change versions the existing GroupBy instead of introducing another GroupBy for the same source and keys.",
      "The requested 14-day purchase_price sum is suitable for offline experimentation and follows repository conventions.",
      "Compilation and eval outcomes are reported accurately."
    ]
  }
}
